[
  {
    "id": "N-01",
    "text": "Institutional incentives matter for explaining economic change over time.",
    "evidence_class": "assigned_reading",
    "source_id": "N94",
    "locator": "PDF page 1, section I; visually inspected",
    "class_number": 1,
    "speaker_role": "author",
    "speaker_confidence": "not_applicable",
    "statement_type": "paraphrase",
    "concept_ids": [
      "institutions"
    ],
    "depends_on": [],
    "status": "source_checked",
    "human_review": "pending",
    "limitations": []
  },
  {
    "id": "N-02",
    "text": "Formal rules, informal constraints, and enforcement jointly structure interaction.",
    "evidence_class": "assigned_reading",
    "source_id": "N94",
    "locator": "PDF page 2, printed page 10, section II; visually inspected",
    "class_number": 1,
    "speaker_role": "author",
    "speaker_confidence": "not_applicable",
    "statement_type": "paraphrase",
    "concept_ids": [
      "institutions"
    ],
    "depends_on": [],
    "status": "source_checked",
    "human_review": "pending",
    "limitations": []
  },
  {
    "id": "N-03",
    "text": "Institutional evolution reflects learning accumulated over time and transmitted through culture; evolving institutions do not guarantee economic growth.",
    "evidence_class": "assigned_reading",
    "source_id": "N94",
    "locator": "PDF page 2, printed page 10, section I; PDF page 5, printed page 13, sections IV–V; visually inspected",
    "class_number": 1,
    "speaker_role": "author",
    "speaker_confidence": "not_applicable",
    "statement_type": "paraphrase",
    "concept_ids": [
      "path-dependence"
    ],
    "depends_on": [],
    "status": "source_checked",
    "human_review": "pending",
    "limitations": []
  },
  {
    "id": "S-01",
    "text": "Development evaluation needs plural concerns; income alone cannot settle social valuation.",
    "evidence_class": "assigned_reading",
    "source_id": "S00",
    "locator": "PDF pages 5–6, printed 20–21",
    "class_number": 1,
    "speaker_role": "author",
    "speaker_confidence": "not_applicable",
    "statement_type": "paraphrase",
    "concept_ids": [
      "plural-evaluation"
    ],
    "depends_on": [],
    "status": "source_checked",
    "human_review": "pending",
    "limitations": []
  },
  {
    "id": "S-02",
    "text": "The value of human development lies in plural attention, and excessive focus on an aggregate index can undermine it.",
    "evidence_class": "assigned_reading",
    "source_id": "S00",
    "locator": "PDF page 7, printed 22, The future",
    "class_number": 1,
    "speaker_role": "author",
    "speaker_confidence": "not_applicable",
    "statement_type": "paraphrase",
    "concept_ids": [
      "plural-evaluation"
    ],
    "depends_on": [],
    "status": "source_checked",
    "human_review": "pending",
    "limitations": []
  },
  {
    "id": "S-03",
    "text": "Weights in social evaluation require reasoned public discussion.",
    "evidence_class": "assigned_reading",
    "source_id": "S00",
    "locator": "PDF page 6, printed 21",
    "class_number": 1,
    "speaker_role": "author",
    "speaker_confidence": "not_applicable",
    "statement_type": "paraphrase",
    "concept_ids": [
      "public-reasoning"
    ],
    "depends_on": [],
    "status": "source_checked",
    "human_review": "pending",
    "limitations": []
  },
  {
    "id": "O-01",
    "text": "Anonymous noncommunicating commons experiments can produce overharvesting; this conditional result does not establish universal failure of cooperation.",
    "evidence_class": "assigned_reading",
    "source_id": "O09",
    "locator": "Supplied 2008 working paper, PDF pages 2, 25–26",
    "class_number": 2,
    "speaker_role": "author",
    "speaker_confidence": "not_applicable",
    "statement_type": "paraphrase",
    "concept_ids": [
      "collective-action"
    ],
    "depends_on": [],
    "status": "source_checked",
    "human_review": "pending",
    "limitations": []
  },
  {
    "id": "O-02",
    "text": "Monitoring and graduated sanctions can support reciprocity by making adherence to shared rules observable.",
    "evidence_class": "assigned_reading",
    "source_id": "O09",
    "locator": "Supplied 2008 working paper, PDF page 25",
    "class_number": 2,
    "speaker_role": "author",
    "speaker_confidence": "not_applicable",
    "statement_type": "paraphrase",
    "concept_ids": [
      "trust-reciprocity"
    ],
    "depends_on": [],
    "status": "source_checked",
    "human_review": "pending",
    "limitations": []
  },
  {
    "id": "O-03",
    "text": "Commons analysis must examine interactions among ecological conditions, social variables, and diverse motivations.",
    "evidence_class": "assigned_reading",
    "source_id": "O09",
    "locator": "Supplied 2008 working paper, PDF page 26; figures PDF pages 37–39",
    "class_number": 2,
    "speaker_role": "author",
    "speaker_confidence": "not_applicable",
    "statement_type": "paraphrase",
    "concept_ids": [
      "collective-action"
    ],
    "depends_on": [],
    "status": "source_checked",
    "human_review": "pending",
    "limitations": []
  },
  {
    "id": "CD-01",
    "text": "Natural capital is a stock yielding future goods and services, including ecosystem functions.",
    "evidence_class": "assigned_reading",
    "source_id": "CD92",
    "locator": "PDF page 3, printed 38",
    "class_number": 2,
    "speaker_role": "author",
    "speaker_confidence": "not_applicable",
    "statement_type": "paraphrase",
    "concept_ids": [
      "natural-capital"
    ],
    "depends_on": [],
    "status": "source_checked",
    "human_review": "pending",
    "limitations": []
  },
  {
    "id": "CD-02",
    "text": "Natural and manufactured capital are largely complementary; efficiency improvements differ from increased throughput.",
    "evidence_class": "assigned_reading",
    "source_id": "CD92",
    "locator": "PDF page 6, printed 41",
    "class_number": 2,
    "speaker_role": "author",
    "speaker_confidence": "not_applicable",
    "statement_type": "paraphrase",
    "concept_ids": [
      "growth-development"
    ],
    "depends_on": [],
    "status": "source_checked",
    "human_review": "pending",
    "limitations": []
  },
  {
    "id": "CD-03",
    "text": "Strong sustainability maintains natural and human-made capital separately; operational principles constrain throughput by ecological capacity.",
    "evidence_class": "assigned_reading",
    "source_id": "CD92",
    "locator": "PDF page 9, printed 44",
    "class_number": 2,
    "speaker_role": "author",
    "speaker_confidence": "not_applicable",
    "statement_type": "paraphrase",
    "concept_ids": [
      "strong-sustainability"
    ],
    "depends_on": [],
    "status": "source_checked",
    "human_review": "pending",
    "limitations": []
  },
  {
    "id": "L1-01",
    "text": "Nora explains institutional rules through predictability, incentives, and bounded risks.",
    "evidence_class": "instructor_lecture",
    "source_id": "L1C",
    "locator": "Speaker 1, 11:28–14:22",
    "class_number": 1,
    "speaker_role": "instructor",
    "speaker_confidence": "medium",
    "statement_type": "paraphrase",
    "concept_ids": [
      "institutions"
    ],
    "depends_on": [],
    "status": "source_checked",
    "human_review": "pending",
    "limitations": []
  },
  {
    "id": "L1-02",
    "text": "Nora connects path dependence to the costs and resistance involved in changing inherited arrangements.",
    "evidence_class": "instructor_lecture",
    "source_id": "L1C",
    "locator": "Speaker 1, 14:22–17:14",
    "class_number": 1,
    "speaker_role": "instructor",
    "speaker_confidence": "medium",
    "statement_type": "paraphrase",
    "concept_ids": [
      "path-dependence"
    ],
    "depends_on": [],
    "status": "source_checked",
    "human_review": "pending",
    "limitations": []
  },
  {
    "id": "L1-03",
    "text": "Nora frames Sen through capabilities, freedoms, education, and environmental conditions at the individual level.",
    "evidence_class": "instructor_lecture",
    "source_id": "L1E",
    "locator": "Speaker 1, 06:36–09:50",
    "class_number": 1,
    "speaker_role": "instructor",
    "speaker_confidence": "medium",
    "statement_type": "paraphrase",
    "concept_ids": [
      "capabilities"
    ],
    "depends_on": [],
    "status": "source_checked",
    "human_review": "pending",
    "limitations": []
  },
  {
    "id": "L1-04",
    "text": "Nora describes a mismatch between environmental problem geographies and governing jurisdictions, alongside communication and implementation barriers.",
    "evidence_class": "instructor_lecture",
    "source_id": "L1C",
    "locator": "Speaker 1, 08:33–11:28",
    "class_number": 1,
    "speaker_role": "instructor",
    "speaker_confidence": "medium",
    "statement_type": "paraphrase",
    "concept_ids": [
      "scale-jurisdiction"
    ],
    "depends_on": [],
    "status": "source_checked",
    "human_review": "pending",
    "limitations": []
  },
  {
    "id": "L1-05",
    "text": "Nora raises the question of who may demand sacrifices from communities when development and environmental protection conflict.",
    "evidence_class": "instructor_lecture",
    "source_id": "L1E",
    "locator": "Speaker 1, 03:56–06:36",
    "class_number": 1,
    "speaker_role": "instructor",
    "speaker_confidence": "medium",
    "statement_type": "paraphrase",
    "concept_ids": [
      "distribution-justice"
    ],
    "depends_on": [],
    "status": "source_checked",
    "human_review": "pending",
    "limitations": []
  },
  {
    "id": "L2-01",
    "text": "Nora presents commons depletion through concentrated incentives and dispersed or delayed consequences.",
    "evidence_class": "instructor_lecture",
    "source_id": "L2",
    "locator": "Speaker 2, 11:53–16:13",
    "class_number": 2,
    "speaker_role": "instructor",
    "speaker_confidence": "medium",